{
 "contract_version": "1.0",
 "correlation_identifier": "DOCUMENT-INVOICE@96353db772d186796c7ed485018c2e5cfe742d20c9a8972d90dc14f9a58b37bf",
 "document": {
 "actions": [
 {
 "enabled": true,
 "identifier": "submit_payment_evidence",
 "label": "Submit payment evidence",
 "metadata": {
 "execution_owner": "host"
 },
 "type": "submit_evidence"
 }
 ],
 "attachments": [],
 "audience": [
 "applicant",
 "billing-operator"
 ],
 "definition_identifier": "DOCUMENT-INVOICE",
 "definition_revision": 1,
 "evidence": [
 {
 "artifact_identifier": "ARTIFACT-APPLICATION-000001",
 "artifact_revision": 1,
 "artifact_type": "Application",
 "payload_path": null,
 "source_reference": "business/profiles/property-reservation/examples/artifacts/application-000001-r1.yaml",
 "subject_identifier": "RESERVATION-000001"
 },
 {
 "artifact_identifier": "ARTIFACT-INVOICE-000001",
 "artifact_revision": 2,
 "artifact_type": "Invoice",
 "payload_path": null,
 "source_reference": "business/profiles/property-reservation/examples/artifacts/invoice-000001-r2.yaml",
 "subject_identifier": "RESERVATION-000001"
 }
 ],
 "identifier": "DOCUMENT-INVOICE@96353db772d186796c7ed485018c2e5cfe742d20c9a8972d90dc14f9a58b37bf",
 "metadata": {
 "definition_source_fingerprint": "b70ca0abd349d2622192ad20e336ec355c96f7c48af3d97a2865fbc54ff29d0e",
 "selected_evidence_count": 2
 },
 "primary_artifact": {
 "identifier": "ARTIFACT-INVOICE-000001",
 "revision": 2,
 "source_reference": "business/profiles/property-reservation/examples/artifacts/invoice-000001-r2.yaml",
 "type": "Invoice"
 },
 "resolution_fingerprint": "96353db772d186796c7ed485018c2e5cfe742d20c9a8972d90dc14f9a58b37bf",
 "sections": [
 {
 "fields": [
 {
 "evidence": [
 {
 "artifact_identifier": "ARTIFACT-APPLICATION-000001",
 "artifact_revision": 1,
 "artifact_type": "Application",
 "payload_path": "payload.applicant_alias",
 "source_reference": "business/profiles/property-reservation/examples/artifacts/application-000001-r1.yaml",
 "subject_identifier": "RESERVATION-000001"
 }
 ],
 "identifier": "applicant_alias",
 "label": "Applicant",
 "metadata": {},
 "value": {
 "type": "string",
 "value": "Ana Example"
 }
 },
 {
 "evidence": [
 {
 "artifact_identifier": "ARTIFACT-APPLICATION-000001",
 "artifact_revision": 1,
 "artifact_type": "Application",
 "payload_path": "payload.lot_identifier",
 "source_reference": "business/profiles/property-reservation/examples/artifacts/application-000001-r1.yaml",
 "subject_identifier": "RESERVATION-000001"
 }
 ],
 "identifier": "lot_identifier",
 "label": "Property",
 "metadata": {},
 "value": {
 "type": "string",
 "value": "LOT-037"
 }
 }
 ],
 "identifier": "reservation",
 "title": "Reservation"
 },
 {
 "fields": [
 {
 "evidence": [
 {
 "artifact_identifier": "ARTIFACT-INVOICE-000001",
 "artifact_revision": 2,
 "artifact_type": "Invoice",
 "payload_path": "payload.amount",
 "source_reference": "business/profiles/property-reservation/examples/artifacts/invoice-000001-r2.yaml",
 "subject_identifier": "RESERVATION-000001"
 }
 ],
 "identifier": "amount",
 "label": "Invoice amount",
 "metadata": {},
 "value": {
 "type": "integer",
 "value": 50000
 }
 },
 {
 "evidence": [
 {
 "artifact_identifier": "ARTIFACT-INVOICE-000001",
 "artifact_revision": 2,
 "artifact_type": "Invoice",
 "payload_path": "payload.currency",
 "source_reference": "business/profiles/property-reservation/examples/artifacts/invoice-000001-r2.yaml",
 "subject_identifier": "RESERVATION-000001"
 }
 ],
 "identifier": "currency",
 "label": "Currency",
 "metadata": {},
 "value": {
 "type": "string",
 "value": "PHP"
 }
 }
 ],
 "identifier": "charges",
 "title": "Charges"
 }
 ],
 "status": "accepted",
 "subject": {
 "identifier": "RESERVATION-000001",
 "type": "PropertyReservation"
 },
 "title": "Reservation Invoice"
 },
 "options": {
 "include_evidence": true
 },
 "request_fingerprint": "9239ff79265155401b4be7ea2077368701817559e7f7fcf8322266cef4e5c40c",
 "request_identifier": "XDOC-REQUEST@9239ff79265155401b4be7ea2077368701817559e7f7fcf8322266cef4e5c40c",
 "requested_capabilities": [
 "actions",
 "attachments",
 "evidence"
 ],
 "requested_driver": "json"
}
