{
    "contract_version": "1.0",
    "correlation_identifier": "DOCUMENT-RECEIPT@ed0e4a5d58402e720ec912ee1d68a35a1d525615da7ea956e95d72ee8510eede",
    "document": {
        "actions": [],
        "attachments": [],
        "audience": [
            "applicant",
            "billing-operator"
        ],
        "definition_identifier": "DOCUMENT-RECEIPT",
        "definition_revision": 1,
        "evidence": [
            {
                "artifact_identifier": "ARTIFACT-APPLICATION-000001",
                "artifact_revision": 1,
                "artifact_type": "Application",
                "payload_path": null,
                "source_reference": "business/profiles/property-reservation/examples/artifacts/application-000001-r1.yaml",
                "subject_identifier": "RESERVATION-000001"
            },
            {
                "artifact_identifier": "ARTIFACT-PAYMENT-APPROVAL-000001",
                "artifact_revision": 1,
                "artifact_type": "PaymentApproval",
                "payload_path": null,
                "source_reference": "business/profiles/property-reservation/examples/artifacts/payment-approval-000001-r1.yaml",
                "subject_identifier": "RESERVATION-000001"
            },
            {
                "artifact_identifier": "ARTIFACT-RECEIPT-000001",
                "artifact_revision": 1,
                "artifact_type": "Receipt",
                "payload_path": null,
                "source_reference": "business/profiles/property-reservation/examples/artifacts/receipt-000001-r1.yaml",
                "subject_identifier": "RESERVATION-000001"
            }
        ],
        "identifier": "DOCUMENT-RECEIPT@ed0e4a5d58402e720ec912ee1d68a35a1d525615da7ea956e95d72ee8510eede",
        "metadata": {
            "definition_source_fingerprint": "0b149b949aa4f1bb159d740efb8ca6fc3dc1068a8646298a76062d5b14ef2ba9",
            "selected_evidence_count": 3
        },
        "primary_artifact": {
            "identifier": "ARTIFACT-RECEIPT-000001",
            "revision": 1,
            "source_reference": "business/profiles/property-reservation/examples/artifacts/receipt-000001-r1.yaml",
            "type": "Receipt"
        },
        "resolution_fingerprint": "ed0e4a5d58402e720ec912ee1d68a35a1d525615da7ea956e95d72ee8510eede",
        "sections": [
            {
                "fields": [
                    {
                        "evidence": [
                            {
                                "artifact_identifier": "ARTIFACT-APPLICATION-000001",
                                "artifact_revision": 1,
                                "artifact_type": "Application",
                                "payload_path": "payload.applicant_alias",
                                "source_reference": "business/profiles/property-reservation/examples/artifacts/application-000001-r1.yaml",
                                "subject_identifier": "RESERVATION-000001"
                            }
                        ],
                        "identifier": "applicant_alias",
                        "label": "Applicant",
                        "metadata": {},
                        "value": {
                            "type": "string",
                            "value": "Ana Example"
                        }
                    },
                    {
                        "evidence": [
                            {
                                "artifact_identifier": "ARTIFACT-APPLICATION-000001",
                                "artifact_revision": 1,
                                "artifact_type": "Application",
                                "payload_path": "payload.lot_identifier",
                                "source_reference": "business/profiles/property-reservation/examples/artifacts/application-000001-r1.yaml",
                                "subject_identifier": "RESERVATION-000001"
                            }
                        ],
                        "identifier": "lot_identifier",
                        "label": "Property",
                        "metadata": {},
                        "value": {
                            "type": "string",
                            "value": "LOT-037"
                        }
                    }
                ],
                "identifier": "reservation",
                "title": "Reservation"
            },
            {
                "fields": [
                    {
                        "evidence": [
                            {
                                "artifact_identifier": "ARTIFACT-RECEIPT-000001",
                                "artifact_revision": 1,
                                "artifact_type": "Receipt",
                                "payload_path": "payload.amount",
                                "source_reference": "business/profiles/property-reservation/examples/artifacts/receipt-000001-r1.yaml",
                                "subject_identifier": "RESERVATION-000001"
                            }
                        ],
                        "identifier": "amount",
                        "label": "Amount received",
                        "metadata": {},
                        "value": {
                            "type": "integer",
                            "value": 50000
                        }
                    },
                    {
                        "evidence": [
                            {
                                "artifact_identifier": "ARTIFACT-RECEIPT-000001",
                                "artifact_revision": 1,
                                "artifact_type": "Receipt",
                                "payload_path": "payload.currency",
                                "source_reference": "business/profiles/property-reservation/examples/artifacts/receipt-000001-r1.yaml",
                                "subject_identifier": "RESERVATION-000001"
                            }
                        ],
                        "identifier": "currency",
                        "label": "Currency",
                        "metadata": {},
                        "value": {
                            "type": "string",
                            "value": "PHP"
                        }
                    },
                    {
                        "evidence": [
                            {
                                "artifact_identifier": "ARTIFACT-PAYMENT-APPROVAL-000001",
                                "artifact_revision": 1,
                                "artifact_type": "PaymentApproval",
                                "payload_path": "payload.outcome",
                                "source_reference": "business/profiles/property-reservation/examples/artifacts/payment-approval-000001-r1.yaml",
                                "subject_identifier": "RESERVATION-000001"
                            }
                        ],
                        "identifier": "approval",
                        "label": "Review outcome",
                        "metadata": {},
                        "value": {
                            "type": "string",
                            "value": "approved"
                        }
                    }
                ],
                "identifier": "payment",
                "title": "Accepted Payment"
            }
        ],
        "status": "accepted",
        "subject": {
            "identifier": "RESERVATION-000001",
            "type": "PropertyReservation"
        },
        "title": "Reservation Receipt"
    },
    "options": {
        "include_evidence": true
    },
    "request_fingerprint": "a6dfa584412612ae70d5f259d092a5315fe87e99e0b799374465198cb9a78e0b",
    "request_identifier": "XDOC-REQUEST@a6dfa584412612ae70d5f259d092a5315fe87e99e0b799374465198cb9a78e0b",
    "requested_capabilities": [
        "actions",
        "attachments",
        "evidence"
    ],
    "requested_driver": "json"
}
